{
  "intake_id": "synthetic-northstar-001",
  "submitted_at": "2026-09-11T00:00:00Z",
  "evidence_class": "prospect_supplied",
  "customer_alias": "Northstar Staffing Lab (synthetic)",
  "contact": {
    "role": "Operations owner",
    "business_email_present": true,
    "process_owner": true
  },
  "workflow": {
    "name": "Applicant completeness follow-up",
    "summary": "Staff manually checks every incoming application for required answers and documents, then drafts follow-up messages for incomplete records.",
    "weekly_volume": 40,
    "operator_minutes_per_item": 8,
    "wait_hours_per_item": 24,
    "rework_percent": 15,
    "systems": ["web form", "shared inbox", "spreadsheet"],
    "data_classes": ["applicant_pii", "resume", "employment"],
    "human_decisions": ["Decide whether the application can proceed", "Approve any external message"],
    "external_actions": ["Send an approved missing-information request"]
  },
  "commercial": {
    "desired_start_days": 21,
    "diagnostic_budget_confirmed": true,
    "implementation_budget_range": "1500_3000"
  },
  "authorization": {
    "can_authorize_discovery": true,
    "production_access_requested": false,
    "autonomous_employment_decision_requested": false,
    "terms_acknowledged": true
  }
}
